{
  "contract": "devices.device/v1",
  "device_id": "kn-sim-001",
  "fpo_id": "fpo_00000000000000000000000001",
  "source_origin": "SIMULATOR",
  "active": true,
  "registered_at": "2026-10-26T07:59:00.000Z",
  "current_assignment": {
    "contract": "devices.assignment/v1",
    "device_id": "kn-sim-001",
    "placement": "IN_GRAIN",
    "crop": "PADDY",
    "assigned_at": "2026-10-26T08:00:00.000Z",
    "sample_interval_s": 300,
    "created_at": "2026-10-26T08:00:01.000Z"
  },
  "last_reading_at": "2026-10-26T09:00:00.000Z"
}
